{
    "name": "starship",
    "version": "1.19.0",
    "description": "Cross-shell prompt - blazing fast shell prompt",
    "homepage": "https://starship.rs",
    "license": "ISC",
    "url": "https://github.com/starship/starship/releases/download/v1.19.0/starship-x86_64-pc-windows-msvc.zip",
    "hash": "",
    "bin": ["starship.exe"],
    "checkver": {
        "url": "https://github.com/starship/starship/releases",
        "regex": "v([\\d.]+)"
    }
}
