{
    "name": "firefox",
    "version": "127.0",
    "description": "Fast, private web browser from Mozilla",
    "homepage": "https://www.mozilla.org/firefox",
    "license": "MPL-2.0",
    "url": "https://download.mozilla.org/?product=firefox-latest&os=win64&lang=en-US",
    "hash": "",
    "nonportable": true,
    "bin": ["firefox.exe"],
    "installer": {
        "type": "inno",
        "args": ["/S"],
        "admin": false
    },
    "checkver": {
        "url": "https://www.mozilla.org/en-US/firefox/releases/",
        "regex": "Firefox ([\\d.]+)"
    }
}
