{
    "name": "visualstudio-code",
    "version": "1.90.2",
    "description": "Visual Studio Code - Code editing. Redefined.",
    "homepage": "https://code.visualstudio.com",
    "license": "MIT",
    "url": "https://update.code.visualstudio.com/latest/win32-x64-user/stable",
    "hash": "",
    "nonportable": true,
    "bin": ["Code.exe"],
    "installer": {
        "type": "inno",
        "args": ["/MERGETASKS=!runcode,!addtopath,!addcontextmenufiles,!addcontextmenufolders"],
        "admin": false
    },
    "shortcuts": [
        ["Code.exe", "Visual Studio Code"]
    ],
    "checkver": {
        "url": "https://api.github.com/repos/microsoft/vscode/releases/latest",
        "jsonpath": "$.tag_name"
    }
}
