{
    "name": "fd",
    "version": "10.2.0",
    "description": "A simple, fast and user-friendly alternative to find",
    "homepage": "https://github.com/sharkdp/fd",
    "license": "Apache-2.0/MIT",
    "url": "https://github.com/sharkdp/fd/releases/download/v10.2.0/fd-v10.2.0-x86_64-pc-windows-msvc.zip",
    "hash": "",
    "extract_dir": "fd-v10.2.0-x86_64-pc-windows-msvc",
    "bin": ["fd.exe"],
    "checkver": {
        "url": "https://github.com/sharkdp/fd/releases",
        "regex": "v([\\d.]+)"
    }
}
