{
    "name": "signal",
    "version": "7.12.0",
    "description": "Private messenger - end-to-end encrypted messaging",
    "homepage": "https://signal.org",
    "license": "GPL-3.0",
    "url": "https://updates.signal.org/windows/SignalSetup-x64.exe",
    "hash": "",
    "nonportable": true,
    "bin": ["Signal.exe"],
    "installer": {
        "type": "nsis",
        "args": ["/S"],
        "admin": false
    },
    "checkver": {
        "url": "https://updates.signal.org/windows/RELEASE.json",
        "jsonpath": "$.version"
    }
}
